"date","user_name","netabare","text"
"2016/03/13","まゆっち","false","なぜ今まで読まなかったのかと後悔するほど感動しました。しをんさんエッセイ大好きだけど小説も好きです。灰二と走、そしてメンバーたちが揺れたりしながら箱根に向かうその過程、そして本番のそれぞれの心情と展開。リアルなフィクションを読んでいるのでは、と錯覚するくらいでした。来年は箱根駅伝がちょっとだけ違って見れる気がします。"
"2016/03/12","詩音@Perc.","false","すごく、さわやかな小説でした。あまり本を読まない友達が全力で押していたのでいったいどんな本なのかと思ったら、最高に面白かったです。"
"2016/03/12","Kanae Nakajima","false","思い立って再読。箱根駅伝を通して描かれる努力神話の光と影。たった10人しかいない、しかも過半数が陸上経験なしというメンバーで箱根に出るストーリー展開は確かにファンタジーかも知れないが、三浦しをんさんが描きたかったのはそんなことではないよな、と改めて思う。だからこそ細部には徹底した取材に裏打ちされたリアリティーがある。走るスピードを体感する為に時速20キロで走る車の窓から顔を出すなどもしたとのことですが、登場人物たちの心の動きの描写ははやはりしをんさんならではの想像力の賜物か。そしてハイジがやはりいい。"
"2016/03/12","ミャウ太郎","false","走ることは美しいのだと言い続けて本当によかったと思えた作品。 本当は、何をするのも孤独なのかもしれないけれど、待っていてくれる人がいるというだけで人は繋がっていけるのかもしれない。 第八章の終わりの「そして、一月二日。箱根駅伝が始まった。」からは泣きっ放しでした。"
"2016/03/11","bassy","true","やばい、すんごい面白かった！今まで読んだ数冊のしをんさんの作品の中で、個人的に舟を編むと１、２を争うほど好きかも♪序盤は男が学生の頃必ず通るオバカな所に共感しつつ笑ってたけど、次第に竹青荘メンバーが迷いながらも各々の走りと向き合っていく姿にどんどん引き込まれました。箱根のシーンはもう、各々が走りと仲間に捧げ、限界を挑んだ今までの時間と思いが襷となって繋がる様は、現実の箱根を見ているかの様で、何度もグッと込み上げるものがありました。走ることと生きることのなんて残酷なまでに美しく輝くドラマなんだろ。清瀬最高！"
"2016/03/11","やんてろー","true","ー強要せず、罰則を設けず、走る気になるまで執念深いほどじっと待つ。…そんなハイジ好きすぎる。走とハイジの関係が羨ましい。『あれは嘘だった』『そんなあんた、いまさら…』のやりとりで笑って、その後のハイジの言葉に涙した。"
"2016/03/11","もも助","false","我が家のお正月は箱根駅伝を観ることから始まる（TVで）。出身校が下位に沈むと、力も抜けて無責任に「もっと頑張れよ～」なんて思っていたけれど、本書を読むと、テレビには映らない下位の選手の一人一人の頑張る姿にもスポットをあててほしいと願うようになった。解説の最相さんのインタビューに対する三浦さんの「できる、できないという基準ではない価値を築けるかどうかを、小説を通じて考えてみたかった」という答えが印象的。6区のユキが山下りで走の体感している世界を垣間見るシーンがとても好きだ。"
"2016/03/10","みほゴロー","false","箱根駅伝のお話。清瀬がいちいちいい。個性の強いメンバーの抱えるものもきちんと描かれていて、特にレースのところは目をつむれば情景が浮かぶほど。泣きながら読んだ。やはり箱根駅伝いいな！"
"2016/03/08","うり坊","false","箱根駅伝をテーマに、走ることとは何かを表現した作品。走ることの意味は人によって異なる。走ることしかできない走。走りたいのに膝に爆弾を抱えている清瀬。清瀬の強権発動により無理やり参加させられた竹青荘の面々など。それでも走っているうちに、それぞれが走る魅力、走る意味を見出し、タスキを繋いでいく。走ることが嫌いな自分でも、走ってみたいと思わされた作品。"
"2016/03/08","イっちゃん","true","何度も何人にも勧められたこの作品。駅伝ちゃんと観たことない。何が面白いんかさっぱりわからん。なんて言っちゃだめないくらい熱狂して観てる人が多くて一層冷めるという、私にはとても遠い存在の駅伝物語。競技のすべてが詳細に書かれてあり、とてもわかりやすかった。指導者側の大きな問題点も。この競技も日本は変革しなければいけない岐路にあるようですな。駅伝の最中にメンバーそれぞれの本当の紹介があり、俄然面白くなったけど、収束の仕方が呆気なく思えた。名前の呼称は一つに統一して欲しかったな。読めて嬉しいお借り本。"
"2016/03/08","ざっきー","false","めざせ、箱根駅伝！ 季節外れですが（読むの遅いから）読んで良かった、泣きながら読んだ。展開がわかってても感動する。もしかして、もしかしたら、いま絶望感と戦ってるあの人が、これを読んで少しでも底に沈んだ気持ちが浮かぶ瞬間があれば良いのにと祈ります。"
"2016/03/07","じゅんちゃん","false","ここ数年、お正月の箱根駅伝をTV観戦して胸の熱くなるシーンを見ていたため、この作品を手にした。走りに対しての選手それぞれの熱い思い、真摯な姿勢、竹青荘住人たちの友情、地域の人とのつながり、箱根駅伝の事情・・・等々、手に取るように描かれている。影の監督（名ばかり監督、大家さんも愛すべき存在！）というべき清瀬は今後も偉大な監督になっていくだろう。応援したくなる。"
"2016/03/07","ばんび","false","すごい良かった。ただそれだけしか言えない。途中で涙が出て、大変だった。"
"2016/03/06","ステ","false","ああいい小説だなあ。なぜ今まで読んでなかった。オススメしてもらって読みました。自分も少しだけ走ったことがあるから理解できるのは、走ることって「浄化」なんだということです。練習や記録会、予選会、そして箱根駅伝の本番。竹青荘の10人の心に湛えられた思い、悩み、葛藤、怒りや悲しみ、そういったものが「走り」によって浄化され「頂点」に昇華していくんです。頂点とは、「どこかにある自分のためのゴール地点」だとハイジは言います。「頂点が見えたかい？」。久しぶりに引き込まれて読んだ小説でした。最高に面白い至高の一冊でした。"
"2016/03/05","木曜日のネコ","false","毎年こたつでみかんを食べながらのんきにみている箱根駅伝も、こうやってランナー目線で細かく描写されると、今さらながらドラマがあるなーと感じました。個性的なキャラクターがみんな魅力的で面白いです。三浦さんのほかの小説も読んでみたいです。"
"2016/03/05","夕力","false","個人的にはあまり関心のなかった題材でしたが、妻に薦められて読んで一変しました。何故箱根駅伝が多くの人を魅了しているのかが良く分かりました。「最大の褒め言葉は速いではなく強い」見方が変わる一言でした。"
"2016/03/04","たむ","false","しょっぱなの部分は主人公はクズっぽいし（犯罪的な意味で）、ちょっと導入に無理があるし、最初のタイムみんな速すぎでしょ！なんて斜に構えた感じで読んでた。それでも、予選会あたりから面白さに拍車がかかってきて最後の箱根駅伝の盛り上がりは最高で一気に読み進めてしまった。ただ、この作品の良さは、走の純粋な走ることに対する想いやスタンスの部分にもあると感じた。読み終わった後にさっそくジョギングしてきたくらい「走る」という行為を魅力的に表現した作品だと思う"
"2016/03/03","Kanako","false","走ることと、人間関係を思いきり味わっている雰囲気がとてもここちよくてペロッと読みおわり。 何を味わうにも楽しむにも、基本は心技体だなぁ。 運動不足すぎる私もちょっと汗かく運動したくなりました。"
"2016/03/03","かみけん","false","☆駅伝小説。選手１０人の個性を描くなかでも、疾走感がすごい。"
"2016/03/03","Law","false","箱根駅伝を走りきった10人に感動した。"
"2016/03/01","けろり","true","色んな風が強く吹いていた！ この本を読み終わると同時に自分も何かやり切ったぞ！という気持ちになりました。神童やユキ先輩が好きでしたが、自分と一番似てるのはキングだなぁと思いました。“強く”なりたいです。"
"2016/02/29","Aya Miura","false","たった10人で挑む箱根駅伝。メンバーそれぞれ個性的だけど憎めなくて，読めば読むほど好きになる。読み終わってしまうのは寂しいけど，ページをめくる手は止められませんでした！涙なしでは読めない一冊。やっぱり駅伝大好きだなー♡"
"2016/02/29","しらたま","false","こころの浄化間違いなし。若くてアツい物語です"
"2016/02/28","くわずいも","false","あ〜、おもしろかった‼︎の一言に尽きる。ただの青春小説かと思ってたら、箱根駅伝の様子はこっちも息を詰めて読み進めるほど緊迫感が伝わる。駅伝もマラソンも一見走ってるだけだから、スポーツ観戦としての面白さがイマイチ分からなかったけど、これを読んだ今となってはじっくり見てみたいなと思う。"
"2016/02/28","相沢翔子","true","私はこの小説が大好きだ。以前読んだけど、また読みたくなって再読。プロローグから、美しい文章に泣きそうになって、読みながら常に半泣きだった。特に、アオタケの10人がそれぞれの箱根駅伝を走るシーン。そのなかでも神童さんのところはもう、文章なのに号泣。ほんとに、なんてうつくしい文章なんだろう。「夢のような一年」。本当に、とても感動した。"
"2016/02/27","ぱっきゃお","false","感動しました。読み進めるほどに涙が止まりません。現実的ではない設定ですが、読み始めると微塵も感じさせずグイグイ引き込まれます。丁寧に取材された作品だからだと思います。仲間との出会い、反発、成長、信じること、10人10区の想い、こころが洗われます。疾走感を感じます。"
"2016/02/27","あんず","false","とてもおもしろかった。アオタケメンバーの走りに対する思いが、それぞれの立場から真摯に描かれていて、多くの場面で涙を流しそうになった。。「強さ」について、走が最後まで考えていたが、そういう葛藤とかも凄い考えさせられた。非常に良作でした。"
"2016/02/27","Kumi","false","面白かったー！何か１つのことに夢中になれるって素敵だなと思いました。来年は箱根駅伝見てみよう。"
"2016/02/27","くりきんとん９９","false","箱根駅伝に興味のない私だったけど、十分に楽しめた。来年は見るべき？箱根駅伝好きの母にこの本をプレゼントしちゃおうかな。"
"2016/02/26","Rie","false","マラソン嫌いな私でも駅伝選手の疑似体験ができ感動。著者の世界観、人間のしんに迫る考察の深さが魅力的でした。"
"2016/02/26","空蝉","false","素人が駅伝に挑戦することのリアリティは横へ置いておいて…素晴らしい作品だった。私は号泣した！読みながら頬を伝う涙の熱は、箱根を走るランナーが読者へ分け与えてくれた情熱のかけらなのかも知れない。"
"2016/02/26","ひーちゃん","false","受験が落ち着き本を読めることへの高揚感を感じながら一気読み。もっぱらインドアで走ることなど苦としか思えない私でさえ、もしかしたら走るって楽しいのかもしれないなんて気になってる。しをんさんマジック。駅伝である以上、主要な人物だけでも多いのに、ページを遡ることなくすんなり認識。ほんとに一緒に過ごしてるみたいに、みんなの人柄がみえてくる。キングの内面が1番共感できたかな。…にしてもキラキラしてたなぁ。私も春からどこかしらの大学生になるわけだ。｢強く｣走る人の姿を見てみたい。間近で。"
"2016/02/24","ゆいつき","false","ほば陸上未経験の10人が箱根駅伝を目指すスポ根ドラマ？コメディ？？個性的な面々が走る姿を読んでいると声を出して応援したくなりました。そして走りたい。これほど熱く手に汗握る物語とは出会ったことがないかもしれません。他の方のレビューでの高評価に納得できるものすごく好きな小説になりました。"
"2016/02/24","みいさま","false","あぁ、青春だなぁ。ドラマに、普通に感動しています。清瀬さんみたいになりたいなぁ。"
"2016/02/24","月歌","false","10人だけで箱根駅伝に出るなんて実際は無謀な気がしますが、読んでいくと本当に出られるんじゃないかと思ってしまいました。 竹青荘の人たちが個性的でそれも楽しめました。 いつもはボケっと見ている箱根駅伝も来年は真剣に見ようと思いました。"
"2016/02/24","age51","false","面白い！この仲間たちと離れたくない。インフルエンザで休んでいるのでゆっくり読めた。"
"2016/02/24","アイA♡","false","青春小説。あぁ素敵。何度も涙しながら読んだ。マラソンと駅伝の違いを分かっていなかった自分が恥ずかしくなった。来年の箱根駅伝は必ず見ようと思った。こんな青春が詰まっているなんて。"
"2016/02/24","Natsuki","false","フルマラソン出場前に再読。というか、もう5回目くらい？2年に一度は読んでるかなあ。 そしてほぼほぼ練習をせずに挑んだフルマラソンだったので、気持ちの勝負でした(笑) 辛いとき奮い立たせてくれたキャラクターたち。ニコチャンや王子の気持ちで完走しました。 最高の本ですね。大好きです。永遠のマイベスト。"
"2016/02/24","sanae","false","箱根駅伝というテーマだけじゃなくて、心理描写が楽しかった。"
"2016/02/22","TAKANORI","false","駅伝選手になったように読めました。キングの行と王子の一区の走りには泣けましたね。機会があれば来年のお正月に再読しょうかな。タイトル通りの作品でした。"
"2016/02/21","thin","false","とっても楽しかった。ストーリーに無理があると思えても、そこに違和感を感じさせない。走るという行為について追求してくれた本。『もっと遠く、深く、美しい場所』。それぞれの理想を目指して、強く走る。週末の時間を見つけて10km程度ランをしている。また、季節が良くなってきたら距離を延ばそうと思う。果たして、何のためにやってるの？と思うとわからないけど。走りながら、日々の目標を見直している気がする。諦めが悪いというか粘り強く続けられている。今年は、この本のおかげでより一層、走りに熱が入りそうです。"
"2016/02/21","あつこんぐ","false","買った直後は気分がのらず、なかなか読み進める事が出来なかったのですが、ちょっと寝かせると｢何これ、面白い!!｣と一気読みしてしまいました。駅伝前はあまりみんなの心の中がわかりませんでしたが、１区走るごとにそれぞれの走者の思いが伝わってきて、襷を渡す時にはウルウルしてしまいました。ただ榊の事はコテンパンにのしてほしかったですが･･･(´-ι_-｀)そして、藤岡が渋すぎる!!いやー、かっこいいわ。"
"2016/02/21","箸","false","何かに打ち込む人の描写に感動しました。登場人物が全員魅力的で、展開も熱い！心が疲れたときに読みたい一冊だと思います。"
"2016/02/21","まさ","false","著者の箱根駅伝に対する思いが伝わる作品です。 箱根駅伝を走る選手の速さ息づかいが伝わってくるようでした。"
"2016/02/20","ガク","false","★5"
"2016/02/20","kazu2","false","良かった。学生時代の部活を思い出した。箱根駅伝見たくなった"
"2016/02/19","きんぴら","true","たった今読み終えました。まず予選会が終わった時点で、ああもうすぐ物語が終わってしまうという寂しい気持ちがあったのですが、そんな寂しさを吹き飛ばすぐらいアツい後半でした。十人それぞれが自分と向き合い自分に打ち勝って激走していく姿は、一言で言い表せるものではありませんが、本当に美しかったです。なんのためとか、誰のためとかいうことでなく、もっと遠く、深く、美しい場所を目指して。私も、彼らのように必死で夢中になれるものにまた出会いたいと心から思いました。"
"2016/02/18","ハルナ","false","「走る」ことを通じて生まれた10人の絆に感動。読めば読むほど引き込まれていきました。最高に爽やかな小説です。"
"2016/02/18","UK","false","ほとんどが走りのド素人の学生集団が箱根駅伝を目指す。と書くと、いかにもありふれて、 いかにも面白そうなスポーツ漫画が目に浮かぶ。後書きにも色々書かれているけど、ホントになんでこんなわかりやすいテーマを選んだのだろうね。ともあれ、読むのがやめられなくて、久々に歩きながらも読んだ本ではある。読友さんも多くは絶賛系なのだが、なんだろうね、この単純さに逆に複雑な気持ち。ありがち。でも面白い。いったい何をもらったのかな。タイトルが秀逸。"
"2016/02/18","ＥＹＥＳ","false","箱根駅伝を補欠なしで走るという実に驚異的な試みを成し遂げた１０人のランナー。それを取りまとめたハイジさん。トップランナーの走（かける）。 一人一人にドラマがあり、とても面白く、元気をもらうお話でした。"
"2016/02/17","dai56","false","個性豊かな登場人物感動しました。"
"2016/02/16","りさ","false","ほんとに面白かった!!竹青荘のみんな最高!! ベタなストーリーなのにどうしてこんなに面白く感動的に書けるんだー!"
"2016/02/16","Eiji","false","読書メーター友達から勧めてもらい読んでみた。自分が読んだ中で一番の長編小説かもだが初めは登場人物多くて把握出来ないかもと思ってたがすぐに把握出来るし箱根を走ってる時の1人1人の感情、描写にすごく引き込まれワクワクしながら一気に読んでしまった(≧∀≦)ﾉハイジさんの人身掌握術は凄すぎる。個人的にはユキのクール中にも熱い物があるのがカッコよかった。箱根駅伝見た事なく2日に分けてるのも初めて知ったけど来年は見てみたいと思えた。"
"2016/02/16","いっさん","false","10人の陸上部(大半は陸上未経験者)が1年で箱根駅伝を走る物語。序盤の展開が唐突すぎてややついていけなかったが、各々が駅伝を走る姿にぐいぐい引き込まれた。｢速さ｣だけじゃない、走ることの｢強さ｣がその姿から伝わってきた。"
"2016/02/15","加藤駿","true","個性溢れる10人のことが大好きになった。最後に灰二さんがゴールしてシードをとることができた時には、読んでるこっちまで本当にうれしくなった。"
"2016/02/15","大阪魂","false","しをんさんの初読みやった本！駅伝がネタってゆうので飛びついたらむっちゃ面白かった！！同じ下宿にすんでる10人、それまで陸上やったことない人が過半数やってゆうのに、夜ランはじめてあっというまに箱根駅伝！！なんぼなんでもそれはありえへんやろ～ってつっこんでたけど、でも途中からはどーでもよくなって、ほんま感動の嵐！！仲間のために走る！駅伝ってやっぱおもろいなあってあらためておもった！！"
"2016/02/13","あけぼ乃","false","走り出すまでの序章が長かったですが、物語が動きはじめたらそれぞれの魅力がぐんぐん増して特に王子の変化に涙が出た。 走のは知る姿は魅力的で本当に美しいものだったのだと思うけど、この本は全員が主人公で、全員が好きだと思えました。 双子の走りの雑念の多さとかキングの負けず嫌いな所とか、ニコちゃん先輩の静かな走りとか素敵だったー。 来年の箱根駅伝はいつもより熱を持って応援してしまいそうです。"
"2016/02/11","Ｍoonlily","false","久しぶりの感動。多少、マンガ的なところはあるものの、ただ走るためだけに青春のすべてを注ぎ込む若者のひたむきさが、ぐんぐん心を掴んでくる。走るために生まれてきた走。その走に出会って自分の夢を叶えようとするハイジ。人と人との出会いが爆発的なエネルギーを生む。大学という、人生のなかでひととき自分のために猶予される時期。こんな時間の使い方があってもいいと思わせられる。なぜ真冬にあんなきつい箱根の山を走るのか、中継を毎年見ていて不思議だった疑問が解けた。青春時代の仲間は身体を使って得るもの。そんな気がしてきた。"
"2016/02/11","はなぴょん","false","なんとなく予想できた流れ。それでも惹きつけられる、魅力的な住人たち。今はハイジになりたい。"
"2016/02/10","CHIEKO","true","人から薦められて読んだ本。なので、自分が普段読まない雰囲気の本でした。箱根駅伝に１０人ジャストで挑戦して夢かなっちゃう話。ハイジの指導力がきっと秀でているのね。走も暴力ふるうわ、万引きするわ相当人としてダメダメだったのにハイジに出会えたことで成長します。しかし、ハイジはなぜ１０人ジャストっていう数字にこだわるのかしら？個人的に病気だけど無理しました、足に爆弾抱えてるけどもう走れなくなるの覚悟で完走しました、という人間はだいっきらいなので、皆様ほどいい評価は与えられない。"
"2016/02/10","マッキー","false","ほとんど初心者のような10人のメンバーが箱根駅伝を目指す物語。駅伝を一度も見たことがない私が、グイグイとその魅力に引き込まれました。勝ち負けの基準ではなく、自分の限界に挑戦しながら仲間と繋がる価値と達成感。メンバーに伴走するように読み進め、最後は熱くうねる感動で胸がいっぱい！ すぐに再読したくなりました。コレは間違いなく名作です。"
"2016/02/09","かすみ","false","すごく素敵な話。たった10人で挑んだ箱根駅伝、最後は涙涙でした。10人みんな大好きだ！毎年ちらっとしか見ない箱根駅伝。来年は絶対見よう！そして再読必須です！"
"2016/02/08","マロ","true","スポ根や箱根駅伝に興味がなく、また下手なサクセスストーリーで落胆するのも嫌で、何となく手に取るのを避けていた。でも読んで本当によかった。何たって登場人物がみんな魅力的だ。そして、何かに真剣に打ち込むことの達成感と孤独の描写が丁寧でぐんぐん引き込まれる。真剣だからこそ「負けた」時に感じる絶望は耐え難い。本書は生きることを勝ち負けという評価軸だけでなく、生きてることそのものの凄さを10人のランナーを通して見せてくれる。勝者になれない自分を励ましてくれる一冊でした。しをんさんありがとうございます。"
