"date","user_name","netabare","text"
"2012/04/21","kazittquattro","false","読みやすく、思いはしっかり感じ取れました。駅伝という個人競技でありながら、集団競技の要素も兼ね備えた特徴と、素人集団というハンデを逆手に取ることでしか出せない個性を織り交ぜ、既存のスポ根小説にはない柔らかさがあったように思います。ただし、まず持って、こんな簡単には箱根駅伝には出られません。箱根駅伝は大学長距離界最高峰の大会であり、今でも多くのファンを魅了して止まないのは、これに出るための努力が並々ならぬものであるからだと思います。こんな設定の甘さにちょっと不満(――〆)を感じた次第です。"
"2012/04/20","Takeru Isaka","false","「風が強く吹いている」読了。キャラの立たせかたがものすごくうまい。十人の部員のエピソードの見せる割合の妙。主人公・走そのものの魅力と言う点では、ややものたりなさはあったものの、脇の活躍、何よりハイジという存在の魅力のつまった小説でした。やっぱり脇が大切なんですよね。"
"2012/04/18","alleine05","false","個性豊かな仲間たち、主人公の成長、走ることの喜びや苦しみ、厳しさ、そして走ることへの問いかけ、そういったことを手堅く丁寧にまとめた王道の良作だった。ただ、これ一冊でまとめてしまわずに上下巻二冊か上中下巻三冊構成でも良かったのでは。"
"2012/04/15","けんさき そのこ","false","箱根駅伝という、ただでさえドラマチックな題材を、陸上未経験者も含む大学生１０人だけで駅伝出場に挑戦するというあり得ない設定を持ってきて、ただ「信じれば夢は叶う物語」的に書かれてあるのかなと思ったが、登場人物のキャラクターが魅力的なのと、それぞれのエピソードがきちんと書かれていて物語にぐいぐい引き込まれた。特に箱根駅伝のレースのところは、自分も読みながら走ってるかのようにどんどん前に読み進んでしまう。そして彼らの心情に気持ちが重なり、何度も泣きそうになった。人間としての強さについて、深く考えさせられた。"
"2012/04/15","しょーこ","false","興奮しながら読み進め、最後はとっても清々しい気持ち。ハイジ、走の走ることへの思い。走らなきゃ得られないもの。 あぁ羨ましい。 ニコチャン、ユキ、キング、ムサ、ジョージ＆ジョータ、王子、神童の8人も箱根に立ち向かうことで自分の変化に気づく。1人1人の個性がキラキラと輝きだし、走るって素敵で美しい。箱根大好きだからこの夢物語に現実を重ねる！ 実際の箱根駅伝にもたくさんのドラマがある。 観客側の気持ちでしかわからなかったけど、この小説には走る側からみたドラマがあるので来年1/2以前に読むことを進めます。"
"2012/04/14","izumi","false","展開が予想しやすいけど、それが涙を誘う。最後の方は涙が止まりません。何かに本気で取り組む姿勢ってホントに素晴らしいです。仲間っていいなー！！"
"2012/04/09","Sayna","false","意識朦朧から助けてくれた本。 読んでてとっても心地いい。 現在友達に貸出中。"
"2012/04/09","ツキスミ","false","箱根駅伝ファンの私としては「箱根はそんな甘いものではない」と、冷めた目で読み始めたが、いつの間にかそんなことは忘れる程、夢中で読み進めていた。一区ごと、脇役たちの走るシーンがそれぞれジーンと来る。もちろん、ラストも感動。"
"2012/04/08","Urso","false","臨場感が伝わってきて、ドキドキ、ハラハラ、ホロリ。たった一人の人が描いた夢。それが、仲間たちがそれぞれの過去、走ることへの想い、自分がなりたい人間像などを考えるなかで、自分自身の夢にもなり、実を結ばせるためにがむしゃらにがんばる姿がかっこいい。単純だけどなんだか走りたくなったし、走ることじゃなくてもいいから何かに打ち込みたい、という気持ちになった。とても温かくて、力強い！！"
"2012/04/07","umico","false","走りたくなった。から、走ることにした。"
"2012/04/06","おはぎ","false","走るという行為と、駅伝という、仲間とたすきをつないでいく競技で繋がる絆がきらきらしています。物語だからこそ、という部分も多くありますが、それでも走る彼らの美しさや、最後の清々しさは筆舌に尽くしがたい。来年の箱根駅伝が今から楽しみになる作品です。"
"2012/04/05","Kaoru","false","陸上未経験者を含んだ寄せ集め陸上部員10名で箱根駅伝を目指す青春小説。手に汗を握る内容で読み終えた後で「面白かった」の感想とともに「よし、走ろう」と思います。"
"2012/04/05","ぴ","false","どきどきしてはらはらして和んで笑ってまたどきどきして、最後はため息と拍手でした。「走る」とは、本当にシンプルなものであるけれど、そこに一人一人の走りがある、思いがある。違ってあるけど、平等に開かれた道を皆汗をかき苦しみながら進んでいる。良い悪いなんかなくて、その人にしか出来ないものがある。人生もそうだなあとしみじみ思いました。名言とも言えるような言葉が、爽やかにそこかしこに散らばっていて、勇気を頂きました。自分は自分の走りをすればいいんだ。読み終えてなんだか凄く、ありがとうという気持ちになりました。"
"2012/04/04","daubentonia","false","これは最高の一冊!感動して泣いて、時々笑って、本当に楽しめた。夢の様な目標に向かって努力し、みんなで襷を繋ぐ、なんて素晴らしい競技なんだ。走る事にも各々に意味があって、それぞれのエピソードも楽しめた。走の走りに魅了されるシーンでは読んでいる自分も鳥肌がたった。"
"2012/04/03","コメマル","false","箱根駅伝を真面目に見ようと思いました。"
"2012/04/03","ゆでたま","false","何度読んでも胸が熱くなる。アオタケの面々の独白に涙がじわりとにじむ。ハイジが走るシーンはもう、涙腺がダメになった。駅伝が好きだからという理由だけで数年前手に取った本だけれど、出会えてよかったと心から思う。スポーツが好きな人にもそうでない人にもお勧めしたい作品。"
"2012/04/02","みずほ","false","とても面白かったです。結構ページ数がありましたが、のめりこんで読みました。最後の箱根駅伝の、一人一人の走っている描写は読んでいて胸が熱くなりました。元気をもらえる本だと思います。"
"2012/03/29","もとやあね","false","これは私の読書傾向から大きく外れているにもかかわらず、胸も目も熱くなる物語でした。"
"2012/03/29","a hayami","false","すなおに面白いですね。これ、映画になったんですか。知らなかった。なんか、けっこうのめり込めたな。走っている時の一人一人の描写、かなり良かったと思います。"
"2012/03/26","ニコ","false","★★★★☆ 面白い！☆４つ！！映画化されないかな～♪"
"2012/03/26","あおい","false","すっごく面白くて一気読みでした。個性豊かなメンバーを時には宥め時には脅しうまく操るハイジが素敵です。"
"2012/03/25","O K","false","89 三浦しをんの作品はどういうわけか敬遠しがちだったけど、よかった。 マラソン青春小説特有の爽やかさや、ページがどんどん進む熱血さも好印象。箱根駅伝に一丸となって目指すメンバーたちの人間模様など、読み応えあります。いろいろ気になる箇所もあったけど面白さは間違いないです。"
"2012/03/23","kyo","false","寛政大学の清瀬灰二、蔵原走をはじめとする竹青荘の住人たち10人が、メンバーの大半が陸上未経験者という状況から箱根駅伝出場、優勝を目指す物語。箱根駅伝やオリンピックを見てると、何で苦しいのに走るんだろう？って不思議に思っていたけど、なぜ走りたくなるのかわかった気がする。今まで、箱根駅伝を真剣に見たことはないけど、次の駅伝はちゃんと見て自分の大学の応援をしてみようと思う。"
"2012/03/22","ぶるぶるどっぐ","false","「風が強く吹いている」三浦しをん読了しました。普段あまりこういうジャンルは読まないんですが、本好きの方から勧められた事もあって手を出してみました。内容は、ほとんどが陸上未経験といった十人が一年半の猛練習で箱根駅伝を目指す、とざっと文字にしてしまうと少年漫画にありきたりなチープな物語に思えてしまうかもしれません。しかし、ページをめくるのが止まらなくなり一気に読めてしまう程の爽快感が有りました。一人一人のキャラが際立っており、(個人的にはムサが好きです)区間ごとにそれぞれが様々な思いを巡らす場面が印象的でした"
"2012/03/22","まゆ","false","この小説は、早く読むのがもったいなくて、少しずつ読んでいた。読んでいるときに、応援せずにはいられなくて章が1つずつ終わると、余韻にいつまでも浸かっていたい気持ちになった。清瀬の走りの描写に、胸が締め付けられて泣きそうになったりしながら読んだが、読了後の爽快感はものすごくよかった！"
"2012/03/20","Keiko","false","仲間っていいね！ 青春っていいね！ 私も走りたい！"
"2012/03/20","てる","false","飄々としたハイジと、彼に導かれる住人たちののんびりしたスポコンぶりがいい。彼らと一緒に疾走しているような、彼らの走りを応援するような気持ちで読み耽ってあっという間に読了。各々の走りの描写は泣けた。仲間と一つのことに必死になれるっていいなと素直に思える素敵な小説だった。"
"2012/03/19","バッタ","false","もう少し深掘りしてほしいな、と思うところもありましたが、評判通りにとても面白かったです。テンポ良く読めましたが、しっかりと感情移入もでき、箱根はそれぞれの思いに共感できるところがあり、引き込まれました。特に王子、ムサ、ユキ、キングが良いです。"
"2012/03/17","めーぷる","false","登場人物に感情移入しやすく、とても読みやすかった。ただ走る。それだけのことに心が熱くなって仕方なかった。走る先に何があるのか。明確な答えは見つからないけど少しずつ確かに掴んでいく走と灰二の成長の様子がとても好きだった。久しぶりにとても暖かい気持ちになりました。もっと読んでいたいくらいでした。"
"2012/03/17","銀河","false","長距離走に全く興味がないのと登場人物が多いのとで、読みやすいのになかなか読み進まなかった。しかし読んでいて気持ちのいい話で、最後には全員の人となりがわかるし、青春時代を懐かしむせつない気持ちも味わった。おもしろかった。九区の走の走りはもちろん爽快だったけれど、意外にいろいろ考えてわかっていたジョータの三区と、全員とまんべんなく楽しく過ごしているキングの悩みに共感した八区が個人的には好き。読み終えた後からじわじわくる気がする。"
"2012/03/16","けんぼう","false","実は学生寮だった下宿に集められた10人が箱根駅伝を目指す話。箱根を訪れて以来、箱根駅伝をテレビで見るようになりました。あの坂を、あの道を、駆け抜ける選手たち。選手の苦悩・仲間との絆・関係者や周りのサポート、たくさんの人々の努力の結晶。人生の縮図のごとき、ドラマあり、感動あり。三浦先生の作品は、ほんと読ませる、一気に図書館にて、読了しました"
"2012/03/15","NT","false","序盤～中盤はペースもあがらず一進一退、終盤は伸びもありラストスパートで一気に追い込みへ。全体としては人物の掘り下げももうひとつで冗長に感じるなぁ。"
"2012/03/15","ゆずりは","false","おんぼろアパートに住む10人がそろった時、箱根駅伝を目指す話。ほとんど素人で箱根を走れるほど世の中甘くないと思うし、狭くもないとは思うけど、読んでてすごく楽しかった。スポーツマンシップやらスポーツに対する精神とかが聞いてて考え直した。人間模様が楽しい。すごーくできすぎたストーリーで、もうちょっと苦難困難があってもよかったと思うけど、それでも最後まで楽しませて読ませる文章力がすごいと思う。読んだ時期が今なのが残念。来年は箱根駅伝をもっとちゃんと見ようかな。"
"2012/03/14","ライス","false","陸上未経験者を含む青竹荘の住人で箱根駅伝を目指す話。 登場人物全員キャラが立っており、心理描写が秀逸で話にぐいぐい引き込まれる。 箱根のシーンでは終始興奮しっぱなしで最後のゴールシーンは感動で涙が出そうでした。 個人的にスポーツ物で本作より優れた作品には未だ出会えていない"
"2012/03/13","いらっしゃいまっせ","false","最初は、ラストは駅伝で云々と思っていました。いや、さすがはしをんさんですね。ハイジと走の走ることへの情熱や竹青荘の８人の仲間全員で目標に向け努力する姿、過去の自分と向き合いながらの成長など、努力しようとしている者へのエールが温かく感じられました。私も中盤から、一挙にラストまでかけ読みました。目頭が何度も熱くなり、努力は努力、結果につながらなくても、意味がある。若者に知って欲しいことですね。また、全てを託し信じられる仲間って良いなぁと思いました。お勧めの青春小説の一つになりました。"
"2012/03/13","あまた","false","随分と都合の良いお話だこと、こんなのあるわけないじゃん、と全編を通して思い続けていましたが、創作なんだからこれくらい都合が良くていいじゃん、という気持ちの良い御伽噺でした。スポーツは好きなのですが、マラソンはある意味単調で色々違うことを考えられてしまうのが好きでなく、範疇外だったのですが、今度の箱根は見てみようかなぁと言う気になりました。映像化に向いていそうな話ね？"
"2012/03/12","にんな","false","読書会の課題本だったので文庫で再読。10人だけで箱根を目指す。しかもメンバーは殆どが陸上未経験。それはとても非現実的な設定で、だからこの小説をファンタジーだと揶揄する人もいる。でもファンタジーでいいじゃない。だって彼らはこんなにも走るということにひたむきで、こんなにも私たちの胸を熱くしてくれるのだから。"
"2012/03/12","nori","false","これは、ほんとにおもしろかった。"
"2012/03/11","最後の羅針盤","false","体育会系クラブ出身の自分にとっては、練習メニューを見ただけでも鼻の穴が拡がったし、強まっていくチームワークには胸が熱くなった。 　勝ち負けや記録ではなくて、自分の頂点や、強い心を持った人間になることを目指すことに意味がある。そこから逃げては得られるものはない。そんなことを教えてくれる指導者に早く出会いたかった・・・ 　おとぎ話のようなのに多くの人にもグッとくるのは、そんな教えが、どんな状況の人にだって当てはまるからに違いない。"
"2012/03/10","にゃきゃ","false","良い表現が見つからないけど、自分はこの本に出合えてよかったと思っています。出会いのきっかけをくれたＦＬＡＳＨの製作者に感謝です。"
"2012/03/10","bb","false","あなたは泣ける程、何かを頑張っていますか？いきなりそう問われたかのようなこの物語は、素人ばかりの１０人で箱根を目指す！というもの。何かを本気で成し遂げようとする時に必要なモノを描いてくれている。みんなをまとめるハイジ、仲間に理解されない言動や強制を用いたりする時もある。でも成し遂げた時、どれだけの達成感や成長が待っているかを知っているから言う、そしてやる。指導って教えてやる事じゃない。相手が成長する事の為に、最大限の共育をすることなんだ。初めて小説で泣いたー。"
"2012/03/09","hime","false","名言とヒントが凝縮された感動作。読メのおかげで出会えました。背中を押されるような勢いで、彼らが走り抜けている冬の箱根の風と息吹を感じながら隙を見てページをめくりました。お正月に再読したいです。大切なのは試合の勝ち負けではなく、自分との戦いに勝てるかどうか、ハイジさんの言葉と10人の成長と深まる絆から私も多く学び、得ました。中盤から涙が止まらなくなり、走と同じことを沿道を走る彼らに叫び伝えたい衝動やみんなとハイタッチしたくなったり。感動できる感性に感謝する程、涙が止まりませんでした。"
"2012/03/08","いか","false","爽快であったかい読後感。勝ち負けでも損得でもなく、好きなことをとことん追い求める幸せ。大事な仲間たちとの絆。"
"2012/03/08","まぁいっか","false","ハイジさんの人を見る目は尊敬に値するものだな。ハイジさんのおかげで，走は強くなれたんだと思う。きっともっともっと強くなるんだろうな。自分が忙しくてなかなかいつものペースで読めなかったけど，7区からは一気に全部読めました，まるでラストスパートをかけるかのように。走と藤岡の走る前の会話，ハイジさんとの電話，ユキが両親とのわだかまりがとけたあたりでググっときたなぁ。秘密兵器は笑ったけれど。この本のおかげで，来年の箱根駅伝から楽しんで見れそうだなぁ♪私も久しぶりに泳ぎにいこうかな。"
"2012/03/08","みほりん","false","箱根駅伝を目指す大学生の話。良かった！どんどん読み進めたくなる本だった。ﾊｲｼﾞの名監督ぶりが素晴らしい。走の不器用ながらも真っ直ぐな所がいい。個性溢れるｱｵﾀｹの住人みんながそれぞれ主役になる場面があり、それぞれ丁寧に描かれていたのも良かった。以前、生で箱根駅伝を見た時に一瞬で過ぎ去るのに熱いﾗﾝﾅｰの気迫を感じて涙して…それをまた思い出させてくれるような文章だった。ﾄﾞｷﾄﾞｷﾜｸﾜｸして、熱くて、爽やかで、引き込まれる本だった。今後の箱根駅伝の見方が変わるね！"
"2012/03/07","桜李","false","ある日突然、「ここの住人全員で箱根駅伝を目指す」と宣言したハイジ。紆余曲折ありながらも、ハイジの指導の下、10人は箱根駅伝目指して練習を始める。10人の個性がすごいです。これをうまくうまくまとめていくハイジがすごい。そして、箱根駅伝のことがとてもよくわかります。舞台裏が。 予選会の様子や、本戦に出場するための条件、各チームのタイムなど、各キャラのテンポ良い会話を楽しみつつ、とても興味深く読める前半。 そして箱根駅伝本番を描く後半。一人ひとりが色んな想いを抱えて、走る中でそれを昇華させていく。続く→"
"2012/03/07","IK-IM","false","2012-19 走るのなんて縁がない自分なのに読んでいると自分まで彼らと共に走っていると錯覚してしまう 主題の走ること襷を渡すことの描写も素晴らしいし１０人＋αの人物の物語にも深くひきこまれる ハイジさんについていきます！"
"2012/03/07","なべさん","false","努力した結果は人それぞれでいい。夢の舞台で走っている寛政大のメンバーは自分と向き合い、仲間を信じてタスキを繋いでいく。ゴールに至るまでのドラマ、描写が素晴らしく、一気読みしてしまった。6区、9区、10区は涙した。読み始めはベタな設定と登場人物だなと思ったが、吹き飛んでしまった。面白かったです。"
"2012/03/06","沢風南","false","『ほら、彼方が見える。きらめくなにかまで、あともう少し。』 マンガ版を再読したら原作も読みたくなって、もう何度めだかわからないほどだけどまた軽く流し読み（笑）やっぱり大好きです！マンガ版をさんざん読み返したあとなので、キャラ達のビジュアルがマンガ版でイメージされました。榊はマンガ版の方が好きだな。"
"2012/03/06","麻呂吉","false","読んでるだけで胸が高なる一冊でした。純粋にスポーツをやるって素敵だなと感じました。思わず想像してウルッとくる場面も･･･こんなに頑張ったことあったっけ？と考えさせられました。"
"2012/03/06","やまだ","false","久しぶりに読んだがやっぱりいい一年で箱根に出るという設定が現実的でないという人もいるかもしれないが、こんなこともあったっていいじゃないかと思う"
"2012/03/05","百鉄","false","読了後は｢僕もﾊｲｼﾞさんに付いて行きます!!｣と宣言したくなりました(笑) それ程にﾊｲｼﾞのﾘｰﾀﾞｰｼｯﾌﾟは素晴らしい。そのﾊｲｼﾞに率いられる王子、ﾑｻ、ｼﾞｮｰﾀ、ｼﾞｮｰｼﾞ、神童、ﾕｷ、ﾆｺﾁｬﾝ、ｷﾝｸﾞ、走の個性豊かな面々。それぞれ良いｷｬﾗしてます(^-^) 特にﾚｰｽ当日のそれぞれ心の葛藤は読み応え充分!! 話の流れは王道で、とても心地良い。本書がｷｯｶｹで箱根駅伝に興味を抱く人が大勢いるのも納得の1冊。"
"2012/03/05","ぽち","false","箱根駅伝の１０人。走ることにそれぞれが意味を見つけ出す。走らないといられない、私にはわからない感覚だったけどすごく伝わってきた。何度も涙腺がうるっってきた。"
"2012/03/02","いずむ","false","息遣いが。足音が。歓声が。確かに聞こえる。魂は奮い立ち、脚の筋肉が熱を帯びる。新年、霊険に満ちる冷気と、それに負けぬ熱気。ぴん、と研ぎ澄まされた箱根の山を、彼らは、いや、ボクらは確かに駆け抜けた。この感覚は、この感動は、果たして共感か、憧憬か。10人が繋いだ襷が教えてくれた。１人で戦っていても、独りではない、というコト。ゴールの先には誰かが待っていてくれるコト。肩にかかる襷を待っている人がいるというコト。彼らほど強くは走れないけれど。一歩前へ進もう。そう言って背中を押してくれる風が、強く強く、吹いている。"
"2012/03/02","fengui","false","名作です。 たくさん笑って泣きました。 それぞれが胸に秘める大切なものは違うけれど、箱根駅伝を目指して戦う竹青荘の住人たち。 それぞれの人物にとても個性があって「早く読みたい、でもお別れしたくない」という思いがとてもありました。 毎年箱根駅伝は楽しみに見ているのですが今年は予選会から見ようかな。 アオタケの住人、周囲の方々に幸あらんことを。 人生でこの本に出会えたことを感謝せずにはいられない、そんな作品です。"
"2012/03/01","しーふぉ","false","駅伝好きなので、思わず手にとってしまいました。正直、素人が特性を活かして･･･というありがちな展開は興醒めでしたが、ボロい寮での共同生活はよかった♪"
"2012/02/29","Santacruzbike","false","何回も読みましたが、それまであまり本を読みませんでしたが、久しぶりに読書に振り向かせてくれた本です。スポーツ・友情系はすごく好きです。映画でいうと、「ジェリーマグワイヤー（じ・エージント）」とか。"
