"date","user_name","netabare","text"
"2014/01/20","琉球蜜柑","true","いわゆるスポ根小説が好きで、 中学生の頃からいくつか有名所を読んできました。この本に関しては、映画化もされたにもかかわらず、何故かついこの間まで手をつけてませんでした。こんな話あるはずがないと批判する人も多くいると聞きますが、そんなこと抜きにしても心に響く小説です。走る姿を描く文章が非常に生き生きとしていて、どんどん引き込まれます。アオタケの住人一人一人のキャラも立っていて、それぞれ孤独を抱えながら生きている。だからこそ惹かれるのかも知れません。『船を編む』より好きかも。"
"2014/01/20","しー","false","箱根駅伝が好き過ぎて、その思いに対しては少し軽く感じたかなー。選手に感情移入する者としては、大晦日や元日の気持ちをもっと追体験したかったです。人手がない中で前日や当日の食事はどうしたのかなんかも、気になる、気になる。そんな時にちょうど、今夜のNHK「サラメシ」が駅伝部の管理栄養士さんの話だということで。あ〜、朝はきな粉もちやカステラがいいのか〜、食物繊維は控えめね〜、とガッテン出来ました。そしてラストまで読了。"
"2014/01/19","ぬぅ","false","【再読】素人がたった１０人で箱根駅伝を目指す。こんなに上手く事が運び、記録が出せるとは思えない。でも、そんな事どうでも良くなるくらい、気付いたら寛政大を応援していた。走り終えてしまうのが惜しい、彼らの挑戦をもっと見ていたいと思った。全編から感じる熱気に、スポーツの、そして物語の素晴らしさを体感しました！"
"2014/01/19","マコト","false","ほぼ素人に近い学生達が、無謀にも箱根駅伝に挑戦する青春物語。走るのはそれぞれ自分一人だけど、10人で1本の襷をつないでゴールを目指すというのは、仲間の魂を感じることができるとても素晴らしい競技だということがわかった。自分も学生時代に、何か全力で仲間と打ち込めるものを見つけたかった…と羨ましく思った。"
"2014/01/18","RED FOX","false","1年足らずのストーリーの中で四季折々の風がちゃんと吹いているのを体感できるんですよ、読んでるだけなのに。そしてレースのシーンではずっと風が鳴りっぱなし！なんてリアルなんでしょう、すげえよ、しをんちゃん(笑)あと、こんなに途中で何回もぐっときた小説も珍しい(>_<)"
"2014/01/18","のんた","false","お正月の風物詩、箱根駅伝。いつも見てるので、楽しく読め、暖かい気持ちになれ、爽やかな読後感でした。10人それぞれ、色々な背景があるけど、それぞれに共感出来ました。"
"2014/01/18","サトシ@練習不足だなあ","false","良かった。僕も彼らを見習ってしっかり練習しようっと。それから昔会社の寮に住んでる時、寮生が中心となってバスケ部を創部し今でもリーグ戦を戦っているのを思い出してしまった。"
"2014/01/18","manzu","false","こんな10人で、しかも一年間で箱根駅伝出場？と思うけど、とても心が温かくなるお話。久しぶりのヒットです。"
"2014/01/17","しんたろ","false","箱根駅伝の話　読み始めは青春すぎてくすぐったかったけど駅伝見たくなった。　駅伝テーマの他の作品か作家の他の作品読みたい"
"2014/01/17","ぱちょ","false","再再読終了。好きで好きで仕方ない本。 また何度も泣いた。走る人達が何を見てるかなんて誰にも解らない。残酷で美しい世界。寂しい場所。自分だけの苦しみてあり喜び。でも走りを通して築く仲間との絆。箱根はテレビで見るのがいいと思ってたけど一度走る彼らを見てみたい。圧倒的な強さを感じてみたい。"
"2014/01/16","Hiro","false","箱根駅伝にこんなドラマがあるなんて知らなかった。予選会の仕組みや区間決め、勝つための様々な駆け引きとチーム力・・・箱根駅伝ファンでなくても楽しめます。魅力的な登場人物たちの頑張りに、最後は涙が止まりませんでした。この作品を読んでから、箱根駅伝が楽しみになりました。 映画化された作品も観ましたが、力強く、美しい走りが表現されていて良かったです。"
"2014/01/16","きょ","false","走るということの凄さに徐々にグイグイ引き込まれた。駅伝が始まってからの竹青荘の面々の心理描写が、静かに激しく沁みてきた。走りながら皆がそれぞれに心の中で見つめ、感じている言葉に感動。走りたいと願い、走ると決意した魂を、とどめられるものなどだれもいない。と走は思う。無心に真摯に、何かを求めて自分はどれだけのことをして毎日を過ごしているか？と己に問う。そして恥じ入る。"
"2014/01/16","grune","true","今年見れなかった箱根駅伝の代わりにもなれた1冊。泣いた。 10人しかも未経験ばかり。 でもあり得ないとかの考えよりどうなるの？っていう期待のが高かった。 だってみんないいキャラだから(笑) 予選会から本大会まで実際に見て応援しているかのような臨場感で読めました。 あと、まさかの地元上尾が出てくるとは！ 小学生のとき参加したこともあるシティマラソンと箱根駅伝。知らなかったぁ。 箱根駅伝当日のエントリーでの駆引きとかも含めて知らなかったこといっぱいで楽しかった。"
"2014/01/16","ゆう","false","秀でた能力に魅せられて箱根駅伝へと物語は進む。箱根駅伝後の取材で選手達が思うことを小説にとりいれていく書き方は面白い。けど、昔からテレビで箱根駅伝を見ていた私としては、箱根駅伝は実況とカメラワークが好きだったのだと気づかされた一冊です。"
"2014/01/14","shinichi","false","★★★★★星五つ これ、めっちゃ面白いや〜ん！読んでいると、一緒に箱根を走った気分になる。箱根駅伝を見る目が変わったな。一つの事に向かって頑張る友情ってイイな。"
"2014/01/13","きゃおりん@スランプ中","false","一気に読んでしまった！！ページが止まらなかった。"
"2014/01/13","マコト","false","まるで少年漫画のようなベタな展開、だがそれが良い。登場人物に感情移入し、気持ちよく泣けて読後は爽やか。青春小説に求めるもの全てが詰まってる。"
"2014/01/13","Hiiii","false","とても美しい小説だった。そして読後感がこれ程まで爽やかな小説は久々！何故走るという単純な動作がここまで人を熱中させ、惹きつけるのか。登場人物一人一人のキャラクターも個性的でそれぞれのストーリーが綿密に作られていてラストの箱根駅伝での10人一人一人の「走るということ」への心情の描写が丁寧に書き込まれていて作者の登場人物への愛が伺えた。唯一の心残りはこの本を今年の箱根駅伝が終わってから読んだこと…。悔しい！今まで全く興味のなかった箱根駅伝が来年から違うものとして見ることができそう。"
"2014/01/12","n","false","みんな大好き。けどユキが一番かも。確かに夢物語。来年の箱根は別の目線で楽しめそう。陸上部だったのもあって内容が入ってきやすかった。しをんすごいなあ。タイトルも意味が深い。ホントは一気に読みたかったけどみんなの一年を楽しみたくて焦らしつつ…もっと読んでいたかった。(つω`*)自然と涙が出る。素晴らしい作品と出会えた"
"2014/01/12","神無月みい","false","ドキドキしながら一気読みした。こういう話はだいたいの展開は読めちゃうけど、それでも涙なしでは読めない。それぞれのキャラも上手く立ってるし、自分にはまったく無縁の世界を体感したような気になれるのが物語の良さだなー。読み終わったら走りたくなってきた(笑)買ってから何年も放置してたのがほんともったいなかったな。もっと早く読めばよかった。"
"2014/01/12","naminaminamina","false","早く続きが読みたかったけど、当日の部分を一気に読める時間があるときを狙って我慢していました。今日やっと再読完了。復路が好きです。復路のサポート往路組も含めて。"
"2014/01/12","chisa","false","2014年、読み初めにふさわしい本を読めていいスタート！また新たなしをんワールドを見せてもらった。もがき苦しみ戦いながら魅せたそれぞれの「強さ」。また限界を超越するたび違って見える景色、風、空気感が見事に表現されていて素晴らしい！しをんさんが長期にわたり取材した賜物だと思う。"
"2014/01/11","caren","false","長らく積読状態にしていたことを後悔。読んでよかった。読めてよかった。ハイジのようなひとになりたい。"
"2014/01/11","ぺい","true","しをんさん、三冊目。ハイジと走。二人の運命の出会いをきっかけに、アオタケ荘のみんなの運命が大きく動き出す。最初はバラバラだった皆の心が、やがて一本の襷で強く結ばれる。箱根駅伝。これまであまり熱心に観てなかったけど、来年はしっかり見よう！きっと、これまでよりもドキドキするはず♪　個性的なメンバーと、大屋さん。魅力的な登場人物から、目が離せません！ここまでしをんさん、外れなし。次は、何を読もうか？★以下、ネタバレ★"
"2014/01/11","たぬき","false","箱根駅伝の往路の日から読み始めたのでずいぶん長く読んでいた。面白くて読み終えるのがもったいなかった。途中で何度も泣きそうになったけど、基本的に電車内で読んでいたので我慢した。純粋にきれいな話で心地よかった。走ったことがなくても楽しめる作品だった。駅伝の場面で一人一人の内面が描かれていてそれぞれ思うところがあったり、なぜ走るのかということや純粋に走りそのものを楽しむ姿が印象的だった。毎年テレビは見ていないけれど、一回くらいちゃんと見てみようかな。いつか生で応援にも行ってみたい。"
"2014/01/11","tiger","false","Ａ＋ 寄せ集めの10人で箱根を目指すスポコン感動系なんだろうと思い、避けていたが、今まで読まなかった私がバカでした。 話がすごく緻密に作りこまれていて、人物も奥深く泣かずにはいられなかった。 スポーツをやってた側からすると、この主人公達みたいにスパッと気持ちを切り替えられるほうが読んでて気持ちがいい。"
"2014/01/10","おおにしかずゆき","false","駅伝や陸上競技って相手に勝つこと為に戦っているが、本質は自分自身との戦いなんだろうなぁ。マラソンは人生そのものなんてよく言うけど、本当にそう思う。隣を走ってる人に勝つために走るんじゃない、自分の為に家族や仲間の為に走る。来年の箱根駅伝が楽しみになる本でした。"
"2014/01/08","まさぼん","false","走りはじめるのを、走り終えて帰ってくるのを、いつでも、いつまでも、待っていてくれる仲間がいる。駅伝とは、そういう競技だ。「走、走るの好きか?」"
"2014/01/08","kzk916","false","毎年箱根駅伝は欠かさず観てます。今年ももちらん。読んでると情景がハッキリあらわれました。駅伝のよさが凄くよくわかるし、箱根駅伝を観たことない人にも是非読んでほしいです。文章もすごく美しいなと思いました。"
"2014/01/07","K1","false","箱根駅伝の時に読友さんにおすすめしてもらいました。地元の人間として箱根駅伝への自身の思い入れと竹青荘の面々の気持ちが読んでいるうちに重なり合い、物語の圧倒的な疾走感、爽快感と共に読了しました。確かに夢のような内容だけど、地元の私もビックリするような情景描写と共にすっかり入り込んでしまいました。努力・勇気・葛藤・愛、竹青荘の面々の抱える全てが愛おしい！！寛政大が襷をつないでいったように、読友さんから受け継いだこの作品を大切な仲間、娘達に繋いでいきたいと思った作品でした。"
"2014/01/07","みみ","false","箱根駅伝に間に合うように読み始めましたが…思うように読書時間が取れず、ようやく読み終えました。箱根駅伝を小さい頃は退屈なTV番組だなぁと思っていましたが、徐々に年を重ねるにつれ箱根駅伝の魅力に少しずつ惹かれてきました。オフ会でおすすめしてもらいこの1冊に出会えて本当に良かった!!さらに箱根駅伝に惹かれました!!ハイジさん、走、竹青荘の皆の努力に勇気を貰いました。ありがとう！"
"2014/01/07","かのこ","false","今年も読んじゃった！何度読んでも鳥肌。走るって美しい！"
"2014/01/07","るーしあ","false","あえて正月の箱根駅伝の時期に読んでみた。素人の集まり、練習期間は１年足らず、部員はたった１０人。これで予選会を突破できるほど箱根駅伝は甘くない。そう、これは夢物語。それもとてもよくできた夢物語だ。いい夢を見ているからこそ心地よく惹き込まれるのかもしれない。箱根駅伝の全員で繋ぐレース模様は１０編の短編集を読んでいるよう。各々の思惑が散りばめられ、歯が浮くようなセリフを的確な場所に放り込んでくる。それが心を揺さぶるツボ。違和感を感じさせない。感動で最後まで涙が止まらない。すごいぞ三浦しをん。これは超オススメ。"
"2014/01/07","みさよ♪","false","箱根駅伝の直前に読み終えるつもりで借りたのに予想以上に長編でようやく読了。箱根駅伝のテレビ観戦は我が家のお正月恒例行事ですが、またまだ知らなかった事があって来年は新たな楽しみ方が加わりそうです。竹青荘の住人や商店街の皆さんのキャラクターが名前も含め秀逸で、まるでホントに応援しているように掌を握りしめている自分がいました。久しぶりに清々しく熱い青春小説に出会いました。シティマラソンも読んでみようかな。"
"2014/01/06","ここり","false","ちょうどランニング始めた頃に読んだので、すごく楽しめた。10キロ30分とか無理なんですけど・・・ｗ"
"2014/01/06","マツ","false","★★★★★ 5度目の再読。今年も箱根駅伝前に読み切ることが出来ませんでした。"
"2014/01/06","Manabu Yamamoto","false","ある意味、組織論でもあった"
"2014/01/06","沢風南","false","再読。やはり箱根駅伝を見ると、この本を読まずにはいられないのです。風強を読んでから、毎年箱根駅伝がとても楽しみになりました。運動音痴で走るの大嫌いな私に、「ああ、こんな風に走れたら素敵だな、走ってみたいな」とまで思わせたのだからスゴイ。実際のところ、近所をジョギングしようとしても200mも走らないうちにバテバテになるんですが…。坂だらけの地形なのを置いといても、体力無さすぎ！"
"2014/01/06","ふーみん","false","箱根駅伝に触発されて選書。続きが気になって早く読みたいと思う小説は久しぶりだった。箱根を駆け抜けるように一気に読了。"
"2014/01/06","ASAKURA","false","何度目の再読か忘れるほど読んだ。自分もハイジのような指導者に出会いたかった。そして、ハイジのような指導者になりたいと思う。"
"2014/01/06","GO。","false","初三浦しをんさん。一部で言われていた通り中身はファンタジーだぜ。こんな展開ありえないぜ。しかも舞台は箱根駅伝だぜ。感動の押し売りはゴメンだぜ。登場人物もみんな身奇麗で、まるでＢLマンガのようだぜ(読んだことねえけど)。男ってもっと陰気で汚い生き物だぜ。………あら？目から汗が出てるぜ。レースが始まってからは、必死に寛政大学を応援してたぜ。ってなわけでどれだけ悪口を言っても、補って余りある感動。走る、ただそれだけの何という美しさ。ランナーの孤独が胸を打つ。泣けたぜ。完敗だぜ。来年の箱根も絶対見るぜ。"
"2014/01/06","らい","false","友達に薦められたのと大好きな箱根駅伝の話だったので手を出しました。10人が駅伝について悩み、進んでいく姿はうつくしく、何かを追求して行く苦しみや辛さをはっきりと浮き彫りにしている。特に感動したのは最後の箱根を走るシーン。それぞれが辛さの中に美しいものを見つけ、大切にすくい取って行く姿がうつくしく、何度も涙が出そうになりました。とても素敵な本でした。"
"2014/01/06","☆緑茶桜☆","false","箱根駅伝☆一つのことをやり遂げることの苦しさ、大変さ☆ハイジと走だけではなくエントリー以外の選手も含め全員が一つになって結果を出さないとダメなのだ☆何事もなくゴールに辿り着ける大学なんてない☆小説のようなドラマが繰り返されるのが箱根☆ハイジの足の故障が現実の選手と重なる☆襷が途切れても、母校の為、自分の為に必死に走る☆繋ぐ為に走ってきた☆なのに、数メートル先を違う襷を掛けて走っていく背中を見た時の悔しさやるせなさ、漏れ聞こえてくる嗚咽☆現実なのか小説なのかもうわからない☆そう、そしてまた来年に繋がった☆"
"2014/01/05","まさ","false","現実とかけ離れるがワクワクした"
"2014/01/05","みちくさ","false","箱根の季節に読みたくなる本。"
"2014/01/05","misako","false","読むのは始めてだったけど、映画はお気に入りで何回も観ていました。やっぱり登場人物のセリフにならない心情が細かく描かれているので、より感動しました。これを読んでから箱根駅伝を見ると、陸上に詳しくなくても楽しめます。"
"2014/01/05","Yumi Kawano","false","この季節に必ず読みたくなる小説。10人しか部員のいない素人チームが箱根駅伝を目指すという話。何度読んでも双子やニコチャンのやり取りにクスリと笑い、箱根本番の場面で大号泣。復路スタート前のユキと神童のやり取りに今年は特にやられました。たぶん来年もまた同じ時期にこの本読むんだろうな。"
"2014/01/05","泥舟斎","false","読書メーター登録設定のための登録で、随分前に読みました。6区のユキのエピソードは涙無しには語れません"
"2014/01/05","蓮","false","箱根駅伝の期間に読み終わることはできませんでしたが、今年も一冊目はこれにしました。何度も読んでいるはずなのに、先へ先へとページをめくる手が止められなません。"
"2014/01/05","壱ヶ谷@多忙","false","三回目になる『風強』。今年の初読はやっぱりコレ。コレを読まずに箱根を終われない。実質は1日～3日の箱根の時期に同時進行で読んだ。三回目となると文字のひとつひとつを噛み締めるようによめるようになってくる。何度読んでも練習中の彼等にはらはらどきどきして予選会で喜びが溢れて、箱根で悲喜こもごもを味わう。「鶴見で待ってて」「走、おまえはずいぶん、さびしい場所にいるんだね」あああ王子がユキ先輩が好きすぎて……。いや、もう寛政の皆が好きすぎて。何度読んでも泣きそうになる。胸が震える。どこまでも眩しい、走りの軌跡。"
"2014/01/04","あみーご","false","もう二回も読んだぞ！"
"2014/01/04","ふらら","false","箱根駅伝に合わせて読みたい本。 自身もランニングに夢中なので早速トレーニングしたくなります！走る人も走らない人も箱根駅伝を観戦したことあるならば是非！箱根駅伝に出るまでもたくさんのドラマが・・・。この本を読むと箱根駅伝が選手だけでなくたくさんの応援する人たちの想いがつまった大会だと改めて実感。"
"2014/01/04","しをり","false","神童が走る場面では毎回泣かされる。気持ちは完全に応援してる観客になりきって、もういいよ！走らなくて、こんなにがんばってる姿はちゃんと見たから、もう棄権して〜(涙)という感じで、なんかもう誰かに追い縋ってる。予選会辺りから、とにかく寛政大学を応援し、駅伝の観客にさせられている、という状況になっていることすら気づかない。"
"2014/01/04","IK-IM","false","2014-1 毎年新年一作目はこれ。3回目なのにまた、心が震えて落涙。ハイジと走は今どの空の下にいるんだろう。"
"2014/01/04","まめな","false","箱根駅伝を見て。 「君を信じる」。言われてみたいし、言ってみたい。面白かった！"
"2014/01/04","あさぎり","false","読書メーター１００冊目、新年初読書にこれ以上ないくらい最高の一冊でした。一気に読了。ボロアパート・青竹荘に住む１０人の大学生が箱根駅伝を目指す物語。７人が陸上未経験で、経験者の内の１人も長く実践から遠ざかっているほとんど素人集団が大学４年のハイジの説得を経て、天下の険、箱根の山を目指す。物語が箱根に突入してからは、テレビから、あるいは実際に沿道から応援しているような感覚で、手に汗握りながら読みました。感動も興奮も満点！駅伝がすきな人にも、今年初めて駅伝を観たわたしのような人にも、ぜひ読んでもらいたい名作。"
"2014/01/04","ゆうちゃん","false","素晴らしい作品だった。駅伝を知らない人が読んでも没頭できる絶妙なキャラクターたち。"
"2014/01/04","みい坊","false","現実の駅伝と同時進行で進む寛政大メンバーの走りに、本気の声援を送っていました。「夢物語」だと思って読んでいた冒頭。走り始めから、記録会。予選会。「夢物語」が現実へと移る様に、もはや完全に応援団となっている自分がいました。メンバーが走ることへの想いを見つけながら進化するチーム。そんなチームを育てたハイジって凄いです。彼はこの走りの先に何を見たのでしょう。寛政大の襷が大手町に戻って来た時には、現実の駅伝と物語と全てが混ざり涙、涙でした。再読します。本当に素敵な本と出会いました。"
"2014/01/03","宇宙猫","false","箱根駅伝が身近になった一冊。昨年に引き続き、1月2日から3日にかけて読んだ。駅伝観戦して、本を読んで、また駅伝を応援して、本を読む。なんて幸せなお正月！"
"2014/01/03","5_yellow_6_red","false","再読。どうしても箱根駅伝の時期には読み返したくなってしまいます(;_;) 癖のあるメンバーだけど、それぞれの走り、生きている姿がとても愛しい。何回か読んだけど、やっぱりハイジが好きだなぁ(>_<)"
"2014/01/03","桜月","false","年末年始の一冊はこれって決めてます。この本に出会ってはじめて、走ることの美しさ、強さを知りました｡今年も箱根駅伝で一本一本の襷がつながっていくのをみていると､自然と涙がこぼれました。『速い』よりも『強い』｡そんな選手たちは、走は灰二たちと重なってしまいました。来年も絶対テレビの前で応援します。"
"2014/01/03","TOM","false","再読"
